{"family":"matplotlib","hasLegend":true,"panelIds":["axes_1","axes_2"],"editableRawTextIds":["text_title","text_legend"],"atomicRasterIds":[],"expectedCapabilities":{"axes_1":["select","drag","resize","delete","reparent"],"axes_2":["select","drag","resize","delete","reparent"],"text_title":["text_edit"]},"fixtureId":"mpl_005","provenanceRef":"mpl_005"}