{"family":"degraded_svg","hasLegend":false,"panelIds":["panel_degraded"],"editableRawTextIds":[],"atomicRasterIds":["raster_panel_1","raster_label_1"],"expectedCapabilities":{"raster_panel_1":["crop_only","replace_image"],"raster_label_1":["group_only"]},"fixtureId":"deg_008","provenanceRef":"deg_008"}