{"family":"static_html_inline_svg","hasLegend":true,"panelIds":["panel_left","panel_right"],"editableRawTextIds":["caption_1"],"atomicRasterIds":[],"expectedCapabilities":{"caption_1":["text_edit"],"panel_left":["select","drag","resize","delete","reparent"]},"fixtureId":"html_002","provenanceRef":"html_002"}